{
  "schema_version": 1,
  "run_name": "brca_pathway_mlp",
  "config": {
    "name": "brca_pathway_mlp",
    "cohort": "TCGA-BRCA",
    "seed": 20260413,
    "study_data_dir": "/kaggle/working/brca_data",
    "modalities": [
      "RNA_seq"
    ],
    "top_k_genes": 1000,
    "model": "pathway_mlp",
    "hidden_dims": [
      128,
      32
    ],
    "dropout": 0.3,
    "use_batchnorm": true,
    "loss": "cox_ph",
    "optimizer": "adam",
    "lr": 0.0001,
    "weight_decay": 0.0001,
    "batch_size": null,
    "max_grad_norm": 1.0,
    "epochs": 50,
    "early_stopping_patience": 10,
    "val_fraction": 0.1,
    "n_folds": 5,
    "pathway_db": "hallmark",
    "pathway_cache_dir": null,
    "attn_d_model": 64,
    "attn_n_heads": 4,
    "attn_n_layers": 2,
    "enable_mlflow": false,
    "mlflow_tracking_uri": null,
    "mlflow_experiment_name": "pathogems",
    "notes": "Pathway-informed MLP using MSigDB Hallmark gene sets (~50 pathways). The first layer is a sparse MaskedLinear connecting each gene only to the pathways it belongs to \u2014 a P-NET style inductive bias. Hidden dims [128, 32] are applied after the pathway layer. Tests whether injecting curated biology into the architecture improves on the flat topk1000 MLP (C-index 0.601).",
    "config_version": 1
  },
  "git_sha": null,
  "started_at": "2026-04-27T00:16:53+00:00",
  "finished_at": "2026-04-27T00:17:21+00:00",
  "wall_clock_sec": 27.399896,
  "status": "success",
  "error": null,
  "metrics": {
    "c_index_mean": 0.5063676577322103,
    "c_index_std": 0.0861569543595153,
    "c_index_folds": [
      0.6097661058678703,
      0.481649069884364,
      0.4014808720691074,
      0.5788225997629396,
      0.46011964107676967
    ],
    "final_loss_mean": 3.141102409362793,
    "final_loss_folds": [
      3.0843591690063477,
      3.5035951137542725,
      2.8299267292022705,
      2.8620078563690186,
      3.4256231784820557
    ],
    "loss_curves": {
      "0": {
        "train": [
          6.538961410522461,
          6.335766792297363,
          6.319857597351074,
          6.773039817810059,
          6.304908275604248,
          6.385418891906738,
          6.264461040496826,
          6.388783931732178,
          6.398786544799805,
          6.720413684844971,
          6.167542934417725,
          6.522878646850586,
          6.028130054473877
        ],
        "val": [
          3.1103837490081787,
          3.0916407108306885,
          3.0843591690063477,
          3.0884134769439697,
          3.095942497253418,
          3.11067795753479,
          3.122775077819824,
          3.1324234008789062,
          3.146298408508301,
          3.1587319374084473,
          3.168886661529541,
          3.179314613342285,
          3.1898741722106934
        ]
      },
      "1": {
        "train": [
          6.030403137207031,
          6.29123592376709,
          6.077157020568848,
          5.959237098693848,
          6.136017322540283,
          5.835796356201172,
          6.047157287597656,
          5.882087707519531,
          6.004144668579102,
          6.07654333114624,
          6.16375732421875,
          5.9950385093688965,
          5.997391700744629,
          5.997399806976318,
          5.939980983734131,
          5.902950286865234,
          6.168522357940674,
          5.960728645324707,
          6.0079874992370605,
          6.069731712341309,
          5.905909061431885,
          5.846170425415039,
          6.066540241241455,
          6.06423282623291,
          6.09904670715332,
          6.07771110534668,
          5.910656452178955,
          5.9408674240112305,
          5.98366641998291,
          5.996555805206299,
          5.881401538848877,
          5.940047264099121,
          5.957374572753906,
          6.049649715423584,
          5.821942329406738,
          5.956229209899902,
          5.9624104499816895,
          5.956057071685791,
          6.02564811706543,
          5.9450531005859375,
          5.827300071716309,
          5.934261322021484,
          5.542900085449219,
          5.727804183959961,
          5.966176509857178,
          5.947976112365723,
          5.90010929107666,
          6.032346248626709,
          5.844151496887207,
          5.859262943267822
        ],
        "val": [
          3.595853567123413,
          3.5784974098205566,
          3.568652391433716,
          3.5593223571777344,
          3.556784152984619,
          3.555851936340332,
          3.554940700531006,
          3.5507538318634033,
          3.5453341007232666,
          3.539381980895996,
          3.5347814559936523,
          3.533134698867798,
          3.5338754653930664,
          3.531961679458618,
          3.5294814109802246,
          3.527350664138794,
          3.528823137283325,
          3.5288338661193848,
          3.5285685062408447,
          3.5263893604278564,
          3.524221181869507,
          3.523038625717163,
          3.5223512649536133,
          3.5204694271087646,
          3.51936411857605,
          3.5196352005004883,
          3.5194997787475586,
          3.519666910171509,
          3.5181729793548584,
          3.5158517360687256,
          3.5154051780700684,
          3.5128471851348877,
          3.51047682762146,
          3.5088491439819336,
          3.507215738296509,
          3.5063650608062744,
          3.5069940090179443,
          3.509568929672241,
          3.509427547454834,
          3.5096399784088135,
          3.508577823638916,
          3.506897211074829,
          3.5067529678344727,
          3.5035951137542725,
          3.5045723915100098,
          3.5053350925445557,
          3.505686044692993,
          3.5056402683258057,
          3.505160331726074,
          3.5045011043548584
        ]
      },
      "2": {
        "train": [
          6.121242046356201,
          6.130731105804443,
          6.020956039428711,
          6.213412284851074,
          6.140288829803467,
          5.905836582183838,
          5.988729953765869,
          6.0540595054626465,
          6.016116619110107,
          6.15323543548584,
          6.106415271759033
        ],
        "val": [
          2.8299267292022705,
          2.8320398330688477,
          2.836557149887085,
          2.8420095443725586,
          2.8448312282562256,
          2.850080966949463,
          2.8511247634887695,
          2.852696657180786,
          2.8533430099487305,
          2.85398268699646,
          2.8561155796051025
        ]
      },
      "3": {
        "train": [
          5.880695343017578,
          5.874795913696289,
          5.915218830108643,
          5.940751075744629,
          5.952748775482178,
          5.690781593322754,
          6.046459674835205,
          6.114345073699951,
          6.086836814880371,
          6.283853054046631,
          6.044716835021973,
          5.927089214324951,
          5.893119812011719,
          6.028133392333984,
          5.931336879730225,
          6.064476013183594,
          6.057158946990967,
          5.967645645141602,
          5.965729713439941,
          5.914562702178955,
          5.79177188873291,
          5.904808521270752
        ],
        "val": [
          2.89471435546875,
          2.895578622817993,
          2.8885750770568848,
          2.883664608001709,
          2.879640817642212,
          2.8748345375061035,
          2.869612216949463,
          2.865192174911499,
          2.863395929336548,
          2.8627748489379883,
          2.8620171546936035,
          2.8620078563690186,
          2.8635597229003906,
          2.8644182682037354,
          2.8657236099243164,
          2.866154432296753,
          2.868943929672241,
          2.8718101978302,
          2.874636173248291,
          2.877971887588501,
          2.881986379623413,
          2.885286569595337
        ]
      },
      "4": {
        "train": [
          6.1437458992004395,
          6.041312217712402,
          5.948380470275879,
          6.014465808868408,
          5.922182559967041,
          6.07323694229126,
          6.051556587219238,
          6.037371635437012,
          5.9762139320373535,
          6.037238597869873,
          5.888623237609863,
          5.869335174560547,
          6.040325164794922,
          5.901007175445557,
          5.981720447540283
        ],
        "val": [
          3.473568916320801,
          3.447690725326538,
          3.43056583404541,
          3.4259865283966064,
          3.4256231784820557,
          3.4288225173950195,
          3.4309709072113037,
          3.434462785720825,
          3.4345452785491943,
          3.434680223464966,
          3.436039924621582,
          3.4360430240631104,
          3.4347684383392334,
          3.4334983825683594,
          3.4328293800354004
        ]
      }
    }
  },
  "environment": {
    "python": "3.12.12",
    "hostname": "e3a9e6d695c1",
    "platform": "Linux-6.6.113+-x86_64-with-glibc2.35",
    "torch": "2.10.0+cpu",
    "cuda": null
  },
  "notes": "Pathway-informed MLP using MSigDB Hallmark gene sets (~50 pathways). The first layer is a sparse MaskedLinear connecting each gene only to the pathways it belongs to \u2014 a P-NET style inductive bias. Hidden dims [128, 32] are applied after the pathway layer. Tests whether injecting curated biology into the architecture improves on the flat topk1000 MLP (C-index 0.601)."
}
