{
  "schema_version": 1,
  "run_name": "brca_pathway_mlp_kegg_filtered",
  "config": {
    "name": "brca_pathway_mlp_kegg_filtered",
    "cohort": "TCGA-BRCA",
    "seed": 20260413,
    "study_data_dir": "/kaggle/working/brca_data",
    "modalities": [
      "RNA_seq"
    ],
    "top_k_genes": 5000,
    "model": "pathway_mlp",
    "hidden_dims": [
      128,
      32
    ],
    "dropout": 0.3,
    "use_batchnorm": true,
    "loss": "cox_ph",
    "optimizer": "adam",
    "lr": 0.0001,
    "weight_decay": 0.0001,
    "batch_size": null,
    "max_grad_norm": 1.0,
    "epochs": 50,
    "early_stopping_patience": 10,
    "val_fraction": 0.1,
    "n_folds": 5,
    "pathway_db": "c2_kegg",
    "pathway_cache_dir": null,
    "pathway_only": true,
    "pathway_scaled_init": false,
    "pathway_residual": false,
    "pathway_norm": "batch",
    "attn_d_model": 64,
    "attn_n_heads": 4,
    "attn_n_layers": 2,
    "enable_mlflow": false,
    "mlflow_tracking_uri": null,
    "mlflow_experiment_name": "pathogems",
    "notes": "Ablation 1/4: pathway_only=True eliminates the UNASSIGNED catch-all node by filtering input genes to only those that map to at least one C2 KEGG pathway. top_k raised to 5000 so ~2750 pathway-assigned genes survive the variance pre-selection (~55% of C2 KEGG's 7012 unique genes). Every gene feeding the MaskedLinear is a real pathway member, giving each pathway node a clean, biologically-grounded signal. Baseline for comparison: brca_pathway_mlp_kegg (CI=0.564, top_k=3000, no filtering).",
    "config_version": 1
  },
  "git_sha": null,
  "started_at": "2026-04-28T04:04:27+00:00",
  "finished_at": "2026-04-28T04:04:57+00:00",
  "wall_clock_sec": 29.361093,
  "status": "success",
  "error": null,
  "metrics": {
    "c_index_mean": 0.5215327814354821,
    "c_index_std": 0.07741647685688073,
    "c_index_folds": [
      0.6142798522773902,
      0.5374560080442433,
      0.49403537638831757,
      0.4065586724614777,
      0.555333998005982
    ],
    "final_loss_mean": 3.1577441692352295,
    "final_loss_folds": [
      3.070723533630371,
      3.5405831336975098,
      2.854076623916626,
      2.8691625595092773,
      3.4541749954223633
    ],
    "loss_curves": {
      "0": {
        "train": [
          6.262728214263916,
          6.357173919677734,
          5.891312599182129,
          6.229877471923828,
          6.45248556137085,
          5.811165809631348,
          5.96701717376709,
          6.085237979888916,
          6.077368259429932,
          6.634860515594482,
          6.251646041870117,
          5.92170524597168,
          6.247318744659424,
          6.170731067657471,
          5.956050395965576,
          6.091062545776367,
          5.946805000305176,
          5.990856647491455,
          5.957159042358398,
          5.799001216888428,
          6.040842056274414,
          5.826827049255371,
          6.051119327545166
        ],
        "val": [
          3.115950584411621,
          3.1049232482910156,
          3.1038565635681152,
          3.101196050643921,
          3.0985429286956787,
          3.0917282104492188,
          3.087235450744629,
          3.0846214294433594,
          3.082285165786743,
          3.0791280269622803,
          3.075685977935791,
          3.0729117393493652,
          3.070723533630371,
          3.072793483734131,
          3.0740301609039307,
          3.0765228271484375,
          3.078260898590088,
          3.079986333847046,
          3.081695556640625,
          3.0848236083984375,
          3.0864157676696777,
          3.0906693935394287,
          3.0946855545043945
        ]
      },
      "1": {
        "train": [
          6.229191303253174,
          6.163557052612305,
          6.112785816192627,
          5.780048847198486,
          6.083915710449219,
          6.036593437194824,
          6.392521381378174,
          6.12471866607666,
          6.236174583435059,
          6.007351875305176,
          6.199687957763672,
          6.2753119468688965,
          5.984997749328613,
          6.13994026184082,
          5.881404399871826,
          6.01231575012207,
          5.91130256652832,
          6.1341023445129395
        ],
        "val": [
          3.6152842044830322,
          3.582390069961548,
          3.558981418609619,
          3.5499000549316406,
          3.546238660812378,
          3.5423285961151123,
          3.5419390201568604,
          3.5405831336975098,
          3.5417847633361816,
          3.5441854000091553,
          3.5492279529571533,
          3.555877685546875,
          3.560818672180176,
          3.5674543380737305,
          3.5735056400299072,
          3.5801503658294678,
          3.5851638317108154,
          3.5909667015075684
        ]
      },
      "2": {
        "train": [
          6.019151210784912,
          6.046408176422119,
          5.913980484008789,
          5.950570106506348,
          6.197800636291504,
          5.967435359954834,
          6.1588568687438965,
          5.956727504730225,
          6.0754714012146,
          6.0677809715271,
          5.8715972900390625,
          5.735381603240967,
          6.052483081817627,
          6.0787787437438965,
          5.94671106338501,
          5.758822441101074,
          6.092721939086914,
          6.010019779205322
        ],
        "val": [
          2.8726227283477783,
          2.883727788925171,
          2.874941825866699,
          2.8670077323913574,
          2.858645439147949,
          2.855409860610962,
          2.8544695377349854,
          2.854076623916626,
          2.8555047512054443,
          2.855980634689331,
          2.85817551612854,
          2.8593568801879883,
          2.8595170974731445,
          2.861046075820923,
          2.862406015396118,
          2.865180253982544,
          2.867723226547241,
          2.871614933013916
        ]
      },
      "3": {
        "train": [
          6.1825480461120605,
          6.137000560760498,
          5.926510334014893,
          5.866228103637695,
          6.236608028411865,
          6.078863620758057,
          5.93403434753418,
          5.723358631134033,
          5.779984474182129,
          6.097823619842529,
          6.1352691650390625,
          5.978641986846924,
          5.963999271392822,
          5.867862224578857,
          5.808313846588135,
          5.989621639251709,
          5.822793006896973,
          5.888472557067871,
          5.831513404846191,
          5.796554088592529,
          5.949575424194336
        ],
        "val": [
          2.8802602291107178,
          2.8751909732818604,
          2.8767242431640625,
          2.8782358169555664,
          2.8772389888763428,
          2.877216339111328,
          2.8763468265533447,
          2.8751091957092285,
          2.872481346130371,
          2.8703081607818604,
          2.8691625595092773,
          2.869319200515747,
          2.8695859909057617,
          2.8705410957336426,
          2.870528221130371,
          2.871035575866699,
          2.872074604034424,
          2.8735532760620117,
          2.8759896755218506,
          2.8784029483795166,
          2.8808724880218506
        ]
      },
      "4": {
        "train": [
          6.397500991821289,
          7.455782413482666,
          6.002518177032471,
          6.254640102386475,
          6.0280256271362305,
          6.426832675933838,
          6.184234142303467,
          6.093610763549805,
          6.245731353759766,
          6.39306640625,
          6.261947154998779,
          6.290783405303955,
          6.06699275970459,
          6.14441442489624,
          6.074461460113525,
          6.190955638885498
        ],
        "val": [
          3.4767942428588867,
          3.4720160961151123,
          3.4672019481658936,
          3.461667537689209,
          3.456305742263794,
          3.4541749954223633,
          3.456336736679077,
          3.4577372074127197,
          3.4585623741149902,
          3.459123373031616,
          3.461472988128662,
          3.4622671604156494,
          3.4633195400238037,
          3.464630126953125,
          3.4658071994781494,
          3.4685912132263184
        ]
      }
    }
  },
  "environment": {
    "python": "3.12.12",
    "hostname": "4a2e63a9fddb",
    "platform": "Linux-6.6.113+-x86_64-with-glibc2.35",
    "torch": "2.10.0+cpu",
    "cuda": null
  },
  "notes": "Ablation 1/4: pathway_only=True eliminates the UNASSIGNED catch-all node by filtering input genes to only those that map to at least one C2 KEGG pathway. top_k raised to 5000 so ~2750 pathway-assigned genes survive the variance pre-selection (~55% of C2 KEGG's 7012 unique genes). Every gene feeding the MaskedLinear is a real pathway member, giving each pathway node a clean, biologically-grounded signal. Baseline for comparison: brca_pathway_mlp_kegg (CI=0.564, top_k=3000, no filtering)."
}
