{
  "schema_version": 1,
  "run_name": "brca_pathway_mlp_kegg",
  "config": {
    "name": "brca_pathway_mlp_kegg",
    "cohort": "TCGA-BRCA",
    "seed": 20260413,
    "study_data_dir": "/kaggle/working/brca_data",
    "modalities": [
      "RNA_seq"
    ],
    "top_k_genes": 3000,
    "model": "pathway_mlp",
    "hidden_dims": [
      128,
      32
    ],
    "dropout": 0.3,
    "use_batchnorm": true,
    "loss": "cox_ph",
    "optimizer": "adam",
    "lr": 0.0001,
    "weight_decay": 0.0001,
    "batch_size": null,
    "max_grad_norm": 1.0,
    "epochs": 50,
    "early_stopping_patience": 10,
    "val_fraction": 0.1,
    "n_folds": 5,
    "pathway_db": "c2_kegg",
    "pathway_cache_dir": null,
    "attn_d_model": 64,
    "attn_n_heads": 4,
    "attn_n_layers": 2,
    "enable_mlflow": false,
    "mlflow_tracking_uri": null,
    "mlflow_experiment_name": "pathogems",
    "notes": "PathwayMLP with MSigDB C2 KEGG gene sets (~186 canonical pathways, ~7000 unique genes) instead of Hallmark (~50 pathways, ~4383 genes). At top_k_genes=3000 the Hallmark run assigned only 711/3000 genes (24%). KEGG's broader coverage should assign ~50-60% of the top-3000 genes, giving the MaskedLinear first layer enough structured signal to be competitive with the flat MLP baseline (C-index ~0.601). More pathways also means finer-grained first-layer bottleneck.",
    "config_version": 1
  },
  "git_sha": null,
  "started_at": "2026-04-28T03:35:13+00:00",
  "finished_at": "2026-04-28T03:35:33+00:00",
  "wall_clock_sec": 19.640402,
  "status": "success",
  "error": null,
  "metrics": {
    "c_index_mean": 0.5638080159740516,
    "c_index_std": 0.0913120683509814,
    "c_index_folds": [
      0.5642183011899877,
      0.6913021618903972,
      0.43315508021390375,
      0.5685499802449625,
      0.561814556331007
    ],
    "final_loss_mean": 3.1528978824615477,
    "final_loss_folds": [
      3.0323145389556885,
      3.5128824710845947,
      2.768728494644165,
      2.9553275108337402,
      3.495236396789551
    ],
    "loss_curves": {
      "0": {
        "train": [
          5.884242057800293,
          6.172738075256348,
          6.193245887756348,
          6.087039470672607,
          6.057385444641113,
          5.982178211212158,
          6.019462585449219,
          5.873363971710205,
          6.026831150054932,
          5.813486099243164,
          5.987029075622559
        ],
        "val": [
          3.0323145389556885,
          3.0371253490448,
          3.045970916748047,
          3.0571393966674805,
          3.0671541690826416,
          3.079110622406006,
          3.0907599925994873,
          3.0982887744903564,
          3.1035826206207275,
          3.1059906482696533,
          3.1079940795898438
        ]
      },
      "1": {
        "train": [
          6.177009582519531,
          6.115795135498047,
          6.189155101776123,
          5.917297840118408,
          6.100105285644531,
          5.872357368469238,
          6.152726173400879,
          6.041345119476318,
          6.121523380279541,
          5.9466729164123535,
          6.158252239227295,
          6.080676078796387,
          6.222890853881836,
          5.959603309631348,
          6.010809421539307,
          6.0028181076049805,
          5.806921482086182,
          5.96454381942749,
          6.111573696136475,
          5.8670854568481445,
          6.053806781768799,
          6.0492048263549805,
          5.879130840301514,
          5.813111782073975,
          5.8322319984436035,
          5.681827068328857,
          5.887749195098877,
          5.836038589477539,
          5.922451496124268,
          5.774547576904297,
          5.922154426574707,
          5.976678371429443,
          5.926713943481445,
          6.053793907165527,
          6.143719673156738,
          5.881786823272705,
          5.801944732666016,
          5.896557331085205,
          5.890637397766113,
          5.8427019119262695,
          5.784257888793945
        ],
        "val": [
          3.6398613452911377,
          3.605510711669922,
          3.588926076889038,
          3.575669050216675,
          3.5700178146362305,
          3.5639405250549316,
          3.559938907623291,
          3.5570783615112305,
          3.554741144180298,
          3.5528388023376465,
          3.551365613937378,
          3.549098014831543,
          3.5478169918060303,
          3.545872449874878,
          3.543402910232544,
          3.5416641235351562,
          3.5385162830352783,
          3.535562753677368,
          3.5333075523376465,
          3.5315988063812256,
          3.529309034347534,
          3.5267434120178223,
          3.5243239402770996,
          3.5222818851470947,
          3.5202956199645996,
          3.5192830562591553,
          3.5174753665924072,
          3.515702247619629,
          3.5138611793518066,
          3.513400077819824,
          3.5128824710845947,
          3.514021396636963,
          3.5164475440979004,
          3.516531229019165,
          3.5156118869781494,
          3.515683889389038,
          3.5174455642700195,
          3.520862340927124,
          3.522855281829834,
          3.5265138149261475,
          3.528085231781006
        ]
      },
      "2": {
        "train": [
          6.0921950340271,
          6.014069557189941,
          6.203734874725342,
          6.075962543487549,
          5.845035076141357,
          6.005195140838623,
          6.054255962371826,
          6.2548136711120605,
          6.181704044342041,
          6.157553672790527,
          6.20661735534668
        ],
        "val": [
          2.768728494644165,
          2.7736313343048096,
          2.773228645324707,
          2.778968095779419,
          2.783987045288086,
          2.788037061691284,
          2.7921576499938965,
          2.7936367988586426,
          2.795243501663208,
          2.7954800128936768,
          2.795564651489258
        ]
      },
      "3": {
        "train": [
          5.948280334472656,
          6.017914295196533,
          5.95394229888916,
          5.672469139099121,
          5.866172790527344,
          6.299865245819092,
          5.913524627685547,
          5.910678386688232,
          6.204420566558838,
          5.903860092163086,
          5.8207807540893555
        ],
        "val": [
          2.9553275108337402,
          2.9732141494750977,
          2.977854013442993,
          2.9853639602661133,
          2.985842227935791,
          2.988166570663452,
          2.9902842044830322,
          2.994091749191284,
          2.9965622425079346,
          3.0015671253204346,
          3.0069382190704346
        ]
      },
      "4": {
        "train": [
          6.108799457550049,
          6.253381252288818,
          6.200275897979736,
          6.3486833572387695,
          6.109026908874512,
          6.208294868469238,
          6.030643463134766,
          6.136106014251709,
          5.966209411621094,
          5.97435188293457,
          5.987011432647705,
          5.820600509643555,
          5.74062967300415
        ],
        "val": [
          3.532402753829956,
          3.510201930999756,
          3.495236396789551,
          3.4964468479156494,
          3.5040154457092285,
          3.5122034549713135,
          3.518472194671631,
          3.526123285293579,
          3.5326120853424072,
          3.538151741027832,
          3.5433924198150635,
          3.548187017440796,
          3.552487373352051
        ]
      }
    }
  },
  "environment": {
    "python": "3.12.12",
    "hostname": "7351f1a42275",
    "platform": "Linux-6.6.113+-x86_64-with-glibc2.35",
    "torch": "2.10.0+cpu",
    "cuda": null
  },
  "notes": "PathwayMLP with MSigDB C2 KEGG gene sets (~186 canonical pathways, ~7000 unique genes) instead of Hallmark (~50 pathways, ~4383 genes). At top_k_genes=3000 the Hallmark run assigned only 711/3000 genes (24%). KEGG's broader coverage should assign ~50-60% of the top-3000 genes, giving the MaskedLinear first layer enough structured signal to be competitive with the flat MLP baseline (C-index ~0.601). More pathways also means finer-grained first-layer bottleneck."
}
